{
  "schema_version": "2.3",
  "project_id": "coverage-validator-unit-30s",
  "truth_revision": "approved-r1",
  "truth_locked_at": "2026-07-21T00:00:00Z",
  "inventory_file": "character-inventory.json",
  "inventory_sha256": "1d4a0e0ace506039935fa6b893fdd8e92e0ba3fce41f91831973212284a4329c",
  "creative_source_file": "character-creative-source.json",
  "creative_source_sha256": "897c64c96055c4b64085431759b50eeb4a7a182488c369f98c7a0d3c82a7b725",
  "shot_cards_file": "character-shot-cards.json",
  "shot_cards_sha256": "e3a551b95e2d8d32f82f8a1ef7d3d1972f60a1c9ad74201557cc630dd5e93716",
  "shot_truth_sha256": "1791d581a746be3b10fa336e758d4344caeb5684d911624b9b6f9e4b48c01ab3",
  "scope": "sequence",
  "duration_seconds": 30,
  "delivery_profile": {
    "medium": "broadcast_tvc",
    "aspect_ratio": "16:9",
    "raster_width": 1920,
    "raster_height": 1080,
    "frame_rate_fps": 25,
    "audio_sample_rate_hz": 48000,
    "action_safe_percent": 90,
    "title_safe_percent": 80,
    "brand_endframe_min_seconds": 3,
    "target_master_spec_status": "requires_target_spec"
  },
  "scene_ids": [
    "office-desk"
  ],
  "character_ids": [
    "protagonist"
  ],
  "appearance_state_ids": [
    "protagonist-office-look"
  ],
  "product_ids": [
    "coldbrew-bottle"
  ],
  "prop_ids": [
    "ice-cup-state"
  ],
  "shot_ids": [
    "S01",
    "S02",
    "S03",
    "S04",
    "S05",
    "S06"
  ],
  "shot_truth": [
    {
      "shot_id": "S01",
      "scene_id": "office-desk",
      "character_ids": [
        "protagonist"
      ],
      "appearance_state_ids": [
        "protagonist-office-look"
      ],
      "product_ids": [],
      "prop_ids": [],
      "story_beat_ids": [
        "B01"
      ],
      "script_line_ids": [],
      "generation_unit_id": "G01",
      "narrative_purpose": "Establish the office pressure and protagonist position without expository text.",
      "timecode": "00:00-00:05",
      "duration_seconds": 5,
      "shot_design": "24mm locked office wide with clear desk geography",
      "action": "The protagonist sorts urgent work without touching the product",
      "sound_edit": "Office room tone and keyboard rhythm establish pressure",
      "continuity_model": "Desk axis, wardrobe, chair position, and screen direction remain locked"
    },
    {
      "shot_id": "S02",
      "scene_id": "office-desk",
      "character_ids": [
        "protagonist"
      ],
      "appearance_state_ids": [
        "protagonist-office-look"
      ],
      "product_ids": [],
      "prop_ids": [],
      "story_beat_ids": [
        "B01"
      ],
      "script_line_ids": [],
      "generation_unit_id": "G01",
      "narrative_purpose": "Move from accumulated pressure toward the product action while preserving screen direction.",
      "timecode": "00:05-00:10",
      "duration_seconds": 5,
      "shot_design": "50mm controlled push along the established desk axis",
      "action": "The protagonist pauses and reaches toward the product area",
      "sound_edit": "Keyboard rhythm thins and one breath creates the transition",
      "continuity_model": "Right-hand reach and eyeline continue directly from S01"
    },
    {
      "shot_id": "S03",
      "scene_id": "office-desk",
      "character_ids": [
        "protagonist"
      ],
      "appearance_state_ids": [
        "protagonist-office-look"
      ],
      "product_ids": [
        "coldbrew-bottle"
      ],
      "prop_ids": [
        "ice-cup-state"
      ],
      "story_beat_ids": [
        "B02"
      ],
      "script_line_ids": [],
      "generation_unit_id": "G02",
      "narrative_purpose": "Show the bottle and cup action with readable identity, level, hand, and label states.",
      "timecode": "00:10-00:15",
      "duration_seconds": 5,
      "shot_design": "85mm product and ice-cup insert with protected label",
      "action": "The bottle opens and pours once into the verified cup",
      "sound_edit": "Seal crack, pour, and ice movement replace the office bed",
      "continuity_model": "Bottle, label, liquid level, cup, ice, and right hand remain exact"
    },
    {
      "shot_id": "S04",
      "scene_id": "office-desk",
      "character_ids": [
        "protagonist"
      ],
      "appearance_state_ids": [
        "protagonist-office-look"
      ],
      "product_ids": [
        "coldbrew-bottle"
      ],
      "prop_ids": [
        "ice-cup-state"
      ],
      "story_beat_ids": [
        "B02"
      ],
      "script_line_ids": [],
      "generation_unit_id": "G02",
      "narrative_purpose": "Hold the first sip as a performance beat without implying an unapproved product effect.",
      "timecode": "00:15-00:20",
      "duration_seconds": 5,
      "shot_design": "75mm profile close-up held without an energy-effect transition",
      "action": "The protagonist takes one sip and allows a restrained pause",
      "sound_edit": "One sip and quiet breath play without an impact effect",
      "continuity_model": "Cup level, bottle-open state, hand ownership, and wardrobe remain fixed"
    },
    {
      "shot_id": "S05",
      "scene_id": "office-desk",
      "character_ids": [
        "protagonist"
      ],
      "appearance_state_ids": [
        "protagonist-office-look"
      ],
      "product_ids": [],
      "prop_ids": [],
      "story_beat_ids": [
        "B03"
      ],
      "script_line_ids": [],
      "generation_unit_id": "G03",
      "narrative_purpose": "Resolve the performance beat with a concrete return to work and stable spatial continuity.",
      "timecode": "00:20-00:25",
      "duration_seconds": 5,
      "shot_design": "35mm return to the locked office geography and work surface",
      "action": "The protagonist resumes one concrete task at the same desk",
      "sound_edit": "Keyboard rhythm returns at the original natural intensity",
      "continuity_model": "No location reset, costume change, or unsupported performance jump"
    },
    {
      "shot_id": "S06",
      "scene_id": "office-desk",
      "character_ids": [
        "protagonist"
      ],
      "appearance_state_ids": [
        "protagonist-office-look"
      ],
      "product_ids": [
        "coldbrew-bottle"
      ],
      "prop_ids": [
        "ice-cup-state"
      ],
      "story_beat_ids": [
        "B03"
      ],
      "script_line_ids": [
        "L01"
      ],
      "generation_unit_id": "G03",
      "narrative_purpose": "Finish on a broadcast-readable product composition with protected brand and legal areas.",
      "timecode": "00:25-00:30",
      "duration_seconds": 5,
      "shot_design": "65mm broadcast-safe bottle composition with clear negative space",
      "action": "The product and cup hold while the work context stays visible",
      "sound_edit": "Office tone resolves beneath a short brand mnemonic",
      "continuity_model": "Bottle, cup, label, title-safe field, and legal-safe field remain readable"
    }
  ],
  "rhythm_point_ids": [
    "R01",
    "R02",
    "R03",
    "R04",
    "R05",
    "R06"
  ],
  "rhythm_points": [
    {
      "id": "R01",
      "timecode": "00:00",
      "shot_ids": [
        "S01"
      ],
      "action": "Begin S01: The protagonist sorts urgent work without touching the product",
      "sound_transition": "Begin S01 sound: Office room tone and keyboard rhythm establish pressure"
    },
    {
      "id": "R02",
      "timecode": "00:05",
      "shot_ids": [
        "S02"
      ],
      "action": "Begin S02: The protagonist pauses and reaches toward the product area",
      "sound_transition": "Begin S02 sound: Keyboard rhythm thins and one breath creates the transition"
    },
    {
      "id": "R03",
      "timecode": "00:10",
      "shot_ids": [
        "S03"
      ],
      "action": "Begin S03: The bottle opens and pours once into the verified cup",
      "sound_transition": "Begin S03 sound: Seal crack, pour, and ice movement replace the office bed"
    },
    {
      "id": "R04",
      "timecode": "00:15",
      "shot_ids": [
        "S04"
      ],
      "action": "Begin S04: The protagonist takes one sip and allows a restrained pause",
      "sound_transition": "Begin S04 sound: One sip and quiet breath play without an impact effect"
    },
    {
      "id": "R05",
      "timecode": "00:20",
      "shot_ids": [
        "S05"
      ],
      "action": "Begin S05: The protagonist resumes one concrete task at the same desk",
      "sound_transition": "Begin S05 sound: Keyboard rhythm returns at the original natural intensity"
    },
    {
      "id": "R06",
      "timecode": "00:25",
      "shot_ids": [
        "S06"
      ],
      "action": "Begin S06: The product and cup hold while the work context stays visible",
      "sound_transition": "Begin S06 sound: Office tone resolves beneath a short brand mnemonic"
    }
  ],
  "style_reference_required": true,
  "generation_units": [
    {
      "unit_id": "G01",
      "shot_ids": [
        "S01",
        "S02"
      ],
      "direct_input_min": 1,
      "direct_input_max": 1,
      "direct_input_roles": [
        "clean_first_frame"
      ],
      "direct_input_not_required_reason": ""
    },
    {
      "unit_id": "G02",
      "shot_ids": [
        "S03",
        "S04"
      ],
      "direct_input_min": 1,
      "direct_input_max": 1,
      "direct_input_roles": [
        "clean_key_frame"
      ],
      "direct_input_not_required_reason": ""
    },
    {
      "unit_id": "G03",
      "shot_ids": [
        "S05",
        "S06"
      ],
      "direct_input_min": 1,
      "direct_input_max": 1,
      "direct_input_roles": [
        "clean_end_frame"
      ],
      "direct_input_not_required_reason": ""
    }
  ],
  "assets": [
    {
      "asset_id": "identity-character-protagonist-protagonist-office-look",
      "role": "character_identity_reference",
      "required": true,
      "action": "generate",